{
  "schema": "lemonpress/manga-style-profile/v0",
  "id": "RENJI_MONO_SOURCE_001",
  "title": "RENJI MONO SOURCE 001",
  "description": "Monochrome documentary/source pressure; independent of language behavior.",
  "tags": [
    "declared-behavior",
    "founding-witness"
  ],
  "laws": [
    "STYLE != CONTENT",
    "STYLE != AUTHORITY",
    "STYLE != ADMISSION",
    "COMPOSITION != COLLAPSE",
    "LAYER != REPLACEMENT",
    "PRIMARY != GLOSS",
    "GLOSS != REPLACEMENT",
    "WORLD TEXT != DIALOGUE",
    "STYLE CONFLICT MUST BE RESOLVED EXPLICITLY",
    "SOURCE TRACE MAY SURVIVE",
    "LANGUAGE PASSAGE MAY REMAIN VISIBLE",
    "STACK CHANGE != SAME CANDIDATE"
  ],
  "domains": {
    "languageBehavior": "none",
    "textChannels": "none",
    "visualPalette": "own",
    "panelBehavior": "own",
    "tone": "suggest",
    "worldMotifs": "none"
  },
  "behavior": {
    "visualPalette": {
      "colors": [
        "#101010",
        "#f4f1e8"
      ],
      "contrast": "high contrast grayscale",
      "light": "architectural clarity"
    },
    "panelBehavior": {
      "rhythm": "evidence dense",
      "insets": "documentary particulars",
      "architecture": "clear architectural geometry"
    },
    "tone": {
      "tension": "spare documentary severity"
    }
  },
  "composition": {
    "layer": "bounded behavior overlay",
    "replacesSource": false
  },
  "authority": {
    "semanticAuthority": false,
    "admission": false,
    "publication": false
  }
}
