{
  "schema": "lemonpress/manga-style-profile/v0",
  "id": "ROOMSTACK_METAPHYSICS_001",
  "title": "ROOMSTACK METAPHYSICS 001",
  "description": "Recurring doors and nested rooms are world motifs.",
  "tags": [
    "declared-behavior",
    "founding-witness"
  ],
  "laws": [
    "STYLE != CONTENT",
    "STYLE != AUTHORITY",
    "STYLE != ADMISSION",
    "COMPOSITION != COLLAPSE",
    "LAYER != REPLACEMENT",
    "PRIMARY != GLOSS",
    "GLOSS != REPLACEMENT",
    "WORLD TEXT != DIALOGUE",
    "STYLE CONFLICT MUST BE RESOLVED EXPLICITLY",
    "SOURCE TRACE MAY SURVIVE",
    "LANGUAGE PASSAGE MAY REMAIN VISIBLE",
    "STACK CHANGE != SAME CANDIDATE"
  ],
  "domains": {
    "languageBehavior": "none",
    "textChannels": "none",
    "visualPalette": "none",
    "panelBehavior": "none",
    "tone": "none",
    "worldMotifs": "own"
  },
  "behavior": {
    "worldMotifs": {
      "doors": "thresholds connect independently constituted rooms",
      "rooms": "one room may open into another"
    }
  },
  "composition": {
    "layer": "bounded behavior overlay",
    "replacesSource": false
  },
  "authority": {
    "semanticAuthority": false,
    "admission": false,
    "publication": false
  }
}
